[
  {
    "name": "devonthink.link-intelligence",
    "description": "Composed link-ops tools (inspect/analyze/act) built on DEVONthink authoritative references and Wiki references with versioned signal contracts.",
    "activation_size": 16,
    "counts": {
      "total": 16,
      "canonical": 9,
      "advanced": 7,
      "internal": 0
    },
    "canonical_tools": [
      "devonthink-link-audit-folder",
      "devonthink-link-audit-record",
      "devonthink-link-check-reciprocal",
      "devonthink-link-detect-bridges",
      "devonthink-link-find-orphans",
      "devonthink-link-map-neighborhood",
      "devonthink-link-resolve",
      "devonthink-link-score",
      "devonthink-link-suggest-related"
    ],
    "advanced_tools": [
      "devonthink-link-build-hub",
      "devonthink-link-compare-snapshots",
      "devonthink-link-enrich-metadata",
      "devonthink-link-maintenance-pass",
      "devonthink-link-prune-snapshots",
      "devonthink-link-repair-links",
      "devonthink-link-traverse-folder"
    ],
    "internal_tools": []
  },
  {
    "name": "devonthink.native",
    "description": "DEVONthink AppleScript dictionary tools generated from DEVONthink.sdef, with canonical/advanced/internal tiering.",
    "activation_size": 24,
    "counts": {
      "total": 134,
      "canonical": 44,
      "advanced": 77,
      "internal": 13
    },
    "canonical_tools": [
      "devonthink-check-file-integrity-of",
      "devonthink-classify",
      "devonthink-compare",
      "devonthink-count",
      "devonthink-exists",
      "devonthink-exists-record-at",
      "devonthink-exists-record-with-comment",
      "devonthink-exists-record-with-content-hash",
      "devonthink-exists-record-with-file",
      "devonthink-exists-record-with-path",
      "devonthink-exists-record-with-url",
      "devonthink-extract-keywords-from",
      "devonthink-get-cached-data-for-url",
      "devonthink-get-cell-at",
      "devonthink-get-concordance-of",
      "devonthink-get-custom-meta-data",
      "devonthink-get-database-by-uuid",
      "devonthink-get-database-with-id",
      "devonthink-get-database-with-uuid",
      "devonthink-get-embedded-images-of",
      "devonthink-get-embedded-objects-of",
      "devonthink-get-embedded-sheets-and-scripts-of",
      "devonthink-get-favicon-of",
      "devonthink-get-feed-items-of",
      "devonthink-get-frames-of",
      "devonthink-get-items-of-feed",
      "devonthink-get-links-of",
      "devonthink-get-metadata-of",
      "devonthink-get-record-at",
      "devonthink-get-record-by-uuid",
      "devonthink-get-record-with-id",
      "devonthink-get-record-with-uuid",
      "devonthink-get-rich-text-of",
      "devonthink-get-text-of",
      "devonthink-get-title-of",
      "devonthink-get-versions-of",
      "devonthink-lookup-records-with-comment",
      "devonthink-lookup-records-with-content-hash",
      "devonthink-lookup-records-with-file",
      "devonthink-lookup-records-with-path",
      "devonthink-lookup-records-with-tags",
      "devonthink-lookup-records-with-url",
      "devonthink-search",
      "devonthink-search-records"
    ],
    "advanced_tools": [
      "devonthink-add-custom-meta-data",
      "devonthink-add-download",
      "devonthink-add-reading-list",
      "devonthink-add-reminder",
      "devonthink-add-row",
      "devonthink-bold",
      "devonthink-close",
      "devonthink-compress",
      "devonthink-convert",
      "devonthink-convert-feed-to-html",
      "devonthink-convert-image",
      "devonthink-create-database",
      "devonthink-create-formatted-note-from",
      "devonthink-create-location",
      "devonthink-create-markdown-from",
      "devonthink-create-pdf-document-from",
      "devonthink-create-record",
      "devonthink-create-record-with",
      "devonthink-create-thumbnail",
      "devonthink-create-web-document-from",
      "devonthink-display-authentication-dialog",
      "devonthink-display-date-editor",
      "devonthink-display-group-selector",
      "devonthink-display-name-editor",
      "devonthink-do-javascript",
      "devonthink-download-json-from",
      "devonthink-download-markup-from",
      "devonthink-download-url",
      "devonthink-duplicate",
      "devonthink-export",
      "devonthink-export-tags-of",
      "devonthink-export-website",
      "devonthink-hide-progress-indicator",
      "devonthink-import-attachments-of",
      "devonthink-import-path",
      "devonthink-import-template",
      "devonthink-imprint",
      "devonthink-imprint-configuration",
      "devonthink-imprinter-configuration-names",
      "devonthink-index-path",
      "devonthink-italicize",
      "devonthink-load-workspace",
      "devonthink-log-message",
      "devonthink-make",
      "devonthink-merge",
      "devonthink-ocr",
      "devonthink-open-database",
      "devonthink-open-tab-for",
      "devonthink-open-window-for",
      "devonthink-paste-clipboard",
      "devonthink-perform-smart-rule",
      "devonthink-plain",
      "devonthink-quit",
      "devonthink-reformat",
      "devonthink-refresh",
      "devonthink-replicate",
      "devonthink-save",
      "devonthink-save-version-of",
      "devonthink-save-workspace",
      "devonthink-scroll-to-visible",
      "devonthink-set-cell-at",
      "devonthink-show-progress-indicator",
      "devonthink-show-search",
      "devonthink-start-downloads",
      "devonthink-step-progress-indicator",
      "devonthink-stop-downloads",
      "devonthink-strike",
      "devonthink-summarize-annotations-of",
      "devonthink-summarize-contents-of",
      "devonthink-summarize-mentions-of",
      "devonthink-summarize-text",
      "devonthink-transcribe",
      "devonthink-unbold",
      "devonthink-underline",
      "devonthink-unitalicize",
      "devonthink-unstrike",
      "devonthink-ununderline"
    ],
    "internal_tools": [
      "devonthink-delete",
      "devonthink-delete-row-at",
      "devonthink-delete-thumbnail",
      "devonthink-delete-workspace",
      "devonthink-move",
      "devonthink-move-into-database",
      "devonthink-move-to-external-folder",
      "devonthink-optimize",
      "devonthink-restore-record-with",
      "devonthink-synchronize",
      "devonthink-update",
      "devonthink-update-thumbnail",
      "devonthink-verify"
    ]
  }
]
